favourites,summary,title,url
50 favorites,,After the fall,https://www.metafilter.com/175012/After-the-fall
41 favorites,"Harlan Ellison , one of the greatest ever speculative fiction writers, died today at the age of 84 .",Possibly the most contentious person on Earth,https://www.metafilter.com/175010/Possibly-the-most-contentious-person-on-Earth
32 favorites,"Since 2011, Butches and Babies (not to be confused with baby butches) has been compiling photos . It’s not at all easy to march through the world shattering gender norms at every turn. So when a butch holds a small child, relatively unaffected by gender (in a cognitive/behavioral sense), it is a simultaneous exchange of healing and freedom. Maybe I think about this too much, but that’s what I see. Every single time. I see hope and a new world.",bring them together,https://www.metafilter.com/175011/bring-them-together
32 favorites (30 in the past 24 hours),"After 45 years, five books, thousands of columns, and appearances in more than 100 MeFi FPPs, The Straight Dope has published its last column .",It Took a Little Longer Than They Thought,https://www.metafilter.com/175000/It-Took-a-Little-Longer-Than-They-Thought
28 favorites,"So you have all this cheese lying around, and you don't fancy eating it. Or maybe, if you're in the US, you're facing down the largest cheese stockpile in a century. What can you do?
Suggestions include paint , plastics , jewelry , glue , fabric , and so much more. Turns out cheese is pretty useful after all.","your move, sir",https://www.metafilter.com/175005/your-move-sir
125 favorites (27 in the past 24 hours),"Amsterdam drained a canal and put everything they found online, piece by piece, chronologically, and you can see it all, from guns to",Under Amsterdam,https://www.metafilter.com/174989/Under-Amsterdam
27 favorites,Joanna Scutts asks: What gets lost when it's only the rebel girls who get lionized?,Well-behaved women make history too,https://www.metafilter.com/175014/Well-behaved-women-make-history-too
27 favorites (26 in the past 24 hours),,Live alone and like it,https://www.metafilter.com/174999/Live-alone-and-like-it
50 favorites (22 in the past 24 hours),"Alice Bolin 's Dead Girls: Essays on Surviving an American Obsession ""attempts to investigate why we are so obsessed with grim images of beautiful women and their overwhelming influence on our culture—from the art that we consume to the ways in which we view living women as they express their own motives and determinations."" [ Esquire ]",Dead Girls,https://www.metafilter.com/174993/Dead-Girls
42 favorites (20 in the past 24 hours),"With US Supreme Court centrist Justice Kennedy's recent decision to retire , Donald Trump now gets a second Supreme Court pick, one that may reshape the SC (and the country) for decades . Moments after the announcement, Mitch McConnell promised a swift confirmation of Trump's nominee before the midterm elections. This appears likely: all Senate Republicans are likely to go along with Trump's conservative nominee even if they grumble about it, while moderate Democrats may break party ranks to also support Trump's nominee .","Now that Kennedy's retiring, Trump gets another SC pick",https://www.metafilter.com/175001/Now-that-Kennedys-retiring-Trump-gets-another-SC-pick
20 favorites (19 in the past 24 hours),,"Students raise £1500 to send ""jolliest"" cleaner to Jamaica",https://www.metafilter.com/175002/Students-raise-1500-to-send-jolliest-cleaner-to-Jamaica
19 favorites,The World Cup 2018 moves into the knockout round of 16.,don't mention the VAR,https://www.metafilter.com/175006/dont-mention-the-VAR
31 favorites (16 in the past 24 hours),Magic for artists: Part 1 Intro ;,The Art in the art,https://www.metafilter.com/174996/The-Art-in-the-art
13 favorites,"Final Deployment 4: Queen Battle Walkthrough [Autoplay Video] “Tips and tricks on how to beat the alien queen boss battle in Final Deployment 4 (Multi-platform) as well as the ""Homecoming"" DLC.”","'Hello, Fellow Gamers'",https://www.metafilter.com/175008/Hello-Fellow-Gamers
12 favorites,"[NSFW text and pics] The setup: A redditor in /r/WTF posts a picture with this description: I found a homemade electric chair while exploring an abandoned building in Croatia. While discussing whether or not it is in fact that, redditor /u/anon72c says, ""Contrary to what you see in movies, a car battery can't hurt you unless you drop it on your foot, or drink the acid."" Another redditor suggests that he try connecting the battery to certain body parts as a test. Challenge accepted.",Not Enough 'Shocking' Puns In Creation For This,https://www.metafilter.com/175009/Not-Enough-Shocking-Puns-In-Creation-For-This
12 favorites,"Here's a surprising extreme heat risk for 1 in 6 Americans Psychiatric medications can interfere with the body's ability to regulate temperature, and most patients don't know, experts say.",Extreme heat can be dangerous for people taking psychiatric medication,https://www.metafilter.com/175020/Extreme-heat-can-be-dangerous-for-people-taking-psychiatric-medication
11 favorites,"Beer and Cider rationed ! Pig Welfare at Risk ! Frozen Food Supplies Hit ! Coca-Cola Production Affected ! And now, in a shocking escalation of the crisis: Crumpet Plants Shut ! The 2018 European CO₂ shortage has been described as the “",The 2018 European carbon dioxide supply crisis,https://www.metafilter.com/175013/The-2018-European-carbon-dioxide-supply-crisis
11 favorites,"Unintended consequences: Inside the fallout of America’s crackdown on opioids. Chronic pain patients, such as Stewart, are driving extraordinary distances to find or continue seeing doctors. They are flying across the country to fill prescriptions. Some have turned to unregulated alternatives such as kratom, which the Drug Enforcement Administration warns could cause dependence and psychotic symptoms. And yet others are threatening suicide on social media, and have even followed through, as doctors taper pain medication in a massive undertaking that Stefan Kertesz, a professor at the University of Alabama at Birmingham who studies addiction and opioids, described as “having no precedent in the history of medicine.”",Chronic pain patients driven to despair,https://www.metafilter.com/175021/Chronic-pain-patients-driven-to-despair
10 favorites,"The corpse flower ( Amorphophallus titanum ), a ten to fifteen-foot tall flower which requires months to years (or decades) to store up enough energy to bloom once, is now in bloom at the NY Botanical Garden . Watch the live stream here.",Corpse Flower in Bloom,https://www.metafilter.com/175004/Corpse-Flower-in-Bloom
44 favorites (8 in the past 24 hours),"Paul McCartney on Carpool Karaoke is television at its best. Not only does it have all the happiness and goofiness you expect Corden to deliver, but this McCartney karaoke is also unexpectedly tender, touching and meaningful.",You can drive my car,https://www.metafilter.com/174966/You-can-drive-my-car
